{"manifest_version":"1.0.0","observation_id":"RLL-PHOTON-EXAMPLE-001","claim_state":"TOKEN_VAZIO","claim_allowed":false,"source_dataset":{"title":"Synthetic public-safe example","publisher":"RLL","dataset_id":"SYNTHETIC-NO-SCIENCE-001","license":"CC0-1.0","access_url":"https://example.invalid/synthetic","sha256":null},"spectral_axis":{"coordinate":"wavelength","unit":"m","coverage":{"min":4e-07,"max":7e-07,"resolution":null}},"flux_axis":{"quantity":"synthetic_flux_density","unit":"arbitrary_unit","calibration_state":"derived"},"spatial":null,"temporal":null,"redshift":null,"stokes":["I"],"instrument":{"facility":"SYNTHETIC","instrument":"NONE","detector":"NONE","response_reference":"TOKEN_VAZIO"},"calibration":{"pipeline":"none","version":"0","background_subtraction":"none","reprojection":null,"psf_matching":null,"lsf":null},"uncertainty":{"statistical":"not_applicable","systematic":"not_applicable","covariance":"not_applicable"},"quality":{"mask":"none","upper_limits":"none","saturation":"none"},"visualization":{"product_state":"rendered_image","normalization":"linear","transfer_function":"identity","channel_mapping":{"R":"synthetic_650nm","G":"synthetic_550nm","B":"synthetic_450nm"},"color_space":"sRGB","clipping":"none","smoothing":"none"},"dark_sector_interpretation":{"state":"TOKEN_VAZIO","operational_definition":null,"claim_allowed":false},"provenance":{"created_at":"2026-07-30T00:00:00Z","software_commit":"TOKEN_VAZIO","transformations":["synthetic_example_only"],"manifest_sha256":null}}
